{
  "Version": 1,
  "Author": "liza",
  "TerritoryBlacklist": [
    1010
  ],
  "QuestSequence": [
    {
      "Sequence": 0,
      "Steps": [
        {
          "DataId": 1038824,
          "Position": {
            "X": 750.97266,
            "Y": 69.99991,
            "Z": 534.78296
          },
          "TerritoryId": 621,
          "InteractionType": "Interact"
        }
      ]
    },
    {
      "Sequence": 1,
      "Steps": [
        {
          "DataId": 1038825,
          "Position": {
            "X": 742.5803,
            "Y": 69.99999,
            "Z": 539.6046
          },
          "TerritoryId": 621,
          "InteractionType": "ManualAction",
          "Comment": "Duty - A Frosty Reception"
        }
      ]
    },
    {
      "Sequence": 3,
      "Steps": [
        {
          "DataId": 172,
          "Position": {
            "X": -408.0791,
            "Y": 24.18463,
            "Z": 479.9764
          },
          "StopDistance": 7,
          "TerritoryId": 958,
          "InteractionType": "AttuneAetheryte"
        },
        {
          "DataId": 1038826,
          "Position": {
            "X": -399.31335,
            "Y": 22.03761,
            "Z": 454.45935
          },
          "TerritoryId": 958,
          "InteractionType": "Interact"
        }
      ]
    },
    {
      "Sequence": 4,
      "Steps": [
        {
          "DataId": 1038836,
          "Position": {
            "X": -439.9939,
            "Y": 22.000002,
            "Z": 497.79492
          },
          "TerritoryId": 958,
          "InteractionType": "Interact"
        }
      ]
    },
    {
      "Sequence": 5,
      "Steps": [
        {
          "DataId": 1038835,
          "Position": {
            "X": -366.17078,
            "Y": 22,
            "Z": 514.4884
          },
          "TerritoryId": 958,
          "InteractionType": "Interact"
        }
      ]
    },
    {
      "Sequence": 6,
      "Steps": [
        {
          "DataId": 1038828,
          "Position": {
            "X": -334.5846,
            "Y": 23.803606,
            "Z": 404.65393
          },
          "StopDistance": 7,
          "TerritoryId": 958,
          "InteractionType": "Interact"
        }
      ]
    },
    {
      "Sequence": 255,
      "Steps": [
        {
          "DataId": 1038837,
          "Position": {
            "X": -353.41425,
            "Y": 22.717295,
            "Z": 435.62976
          },
          "StopDistance": 5,
          "TerritoryId": 958,
          "InteractionType": "Interact"
        }
      ]
    }
  ]
}
