{
  "Version": 1,
  "Author": "liza",
  "TerritoryBlacklist": [
    992
  ],
  "QuestSequence": [
    {
      "Sequence": 0,
      "Steps": [
        {
          "DataId": 1039987,
          "Position": {
            "X": 189.25769,
            "Y": 63.36112,
            "Z": 467.46008
          },
          "TerritoryId": 959,
          "InteractionType": "Interact"
        }
      ]
    },
    {
      "Sequence": 1,
      "Steps": [
        {
          "DataId": 1039987,
          "Position": {
            "X": 189.25769,
            "Y": 63.36112,
            "Z": 467.46008
          },
          "TerritoryId": 959,
          "InteractionType": "Interact"
        }
      ]
    },
    {
      "Sequence": 2,
      "Steps": [
        {
          "DataId": 2012122,
          "Position": {
            "X": 99.96179,
            "Y": -0.015319824,
            "Z": 103.227295
          },
          "TerritoryId": 1028,
          "InteractionType": "ManualAction",
          "Comment": "Duty - Zodiark"
        }
      ]
    },
    {
      "Sequence": 255,
      "Steps": [
        {
          "DataId": 1039989,
          "Position": {
            "X": -279.95728,
            "Y": 76.14732,
            "Z": 480.91858
          },
          "StopDistance": 5,
          "TerritoryId": 959,
          "InteractionType": "Interact"
        }
      ]
    }
  ]
}
